{
  "schema_version": 1,
  "reviewed_at": "2026-09-15",
  "id": "cline",
  "version": "3.0.62",
  "node_version": "v26.8.2",
  "licence": "Apache-2.0 with embedded Bun MIT/LGPL-2 scope",
  "launcher_sha256": "ea15ebeb9a27bd1a0afa1885a19ed6fc637f174bc68a78089d8e3c58096d75d2",
  "packages": [
    {
      "name": "cline",
      "version": "3.0.62",
      "url": "https://registry.npmjs.org/cline/-/cline-3.0.62.tgz",
      "destination": "node_modules/cline",
      "sha256": "7a4df4ecf7613cb872c5c8916d82d247af13a69b4033bef88d41c5f13820802c",
      "sha512": "f571f56e93e28bdc9e4768cd9f8bc41275d723b261de6aad41d84f02225749c3d1304a4509be2114a630138b547cde9d8867a6c5af0b11df2478827a8c190c64",
      "members": [
        {
          "path": "package/LICENSE",
          "size": 11344,
          "sha256": "f704446a5f1271608805598b557e4288cf8580477ea038c9c3d8b361f693f6b8",
          "executable": false
        },
        {
          "path": "package/README.md",
          "size": 16412,
          "sha256": "94c3c1b240b5e8a971cc806876dde2e893c78c8cc0085efe23c961e113c197ad",
          "executable": false
        },
        {
          "path": "package/bin/ca-certs.cjs",
          "size": 8751,
          "sha256": "46c23ae7f4deff43def64d3e61f8054407bf2a2ce571448880648835e7c7a4f0",
          "executable": false
        },
        {
          "path": "package/bin/cline",
          "size": 5439,
          "sha256": "37848dcde533871a1a95af479221c8768292652ae73c73a8825288a67470f355",
          "executable": true
        },
        {
          "path": "package/package.json",
          "size": 1231,
          "sha256": "770c559068aa04ce6e3fc7cd9306fe7b7011ad7409f5b5fbb05c9133cee94b40",
          "executable": false
        },
        {
          "path": "package/postinstall.mjs",
          "size": 4187,
          "sha256": "d530c5980c8c17cd44eae229bd708fa71ff18d67db0569e0ecdedad3a7533459",
          "executable": false
        }
      ]
    },
    {
      "name": "@cline/cli-linux-x64",
      "version": "3.0.62",
      "url": "https://registry.npmjs.org/@cline/cli-linux-x64/-/cli-linux-x64-3.0.62.tgz",
      "destination": "node_modules/@cline/cli-linux-x64",
      "sha256": "f1fdf64dab9ea37546fe39662ad0336712e31497eee954fd82003d7c79b35320",
      "sha512": "1d18ffdec158ffcd6d3afdf2ce75624ae4ba1b994457b1919442ef3e2d64d1e01fcec825847ea480f9c508cfa3309ec2ddebf07fc9d5cefadc3fec62a4f9478b",
      "members": [
        {
          "path": "package/bin/cline",
          "size": 151320896,
          "sha256": "2057f88bda64726ef38f5ab43902bd98f3f96caa68837ce00bd7b83287d3c810",
          "executable": true
        },
        {
          "path": "package/cline-hub/webview/32x32.png",
          "size": 1942,
          "sha256": "22c52dbe52ac431d0542fe502d6b16e018171cb19ab333e2d4693aab11761ae3",
          "executable": false
        },
        {
          "path": "package/cline-hub/webview/assets/Chat-BGDW3Im_.js",
          "size": 899274,
          "sha256": "034fe3a5819dd447ff719ee83e9dae8fff3ab2c84187d551f663d6e1dfe82a81",
          "executable": false
        },
        {
          "path": "package/cline-hub/webview/assets/abnfDiagram-N423BO3Z-CA3n4CVB.js",
          "size": 1893,
          "sha256": "0d8b96ec6324d3bb982938c5552ab29576bec9e540ad82272c95273f2c238cce",
          "executable": false
        },
        {
          "path": "package/cline-hub/webview/assets/arc-3UKfLtkz.js",
          "size": 3474,
          "sha256": "ce50be5dfe11aaa0943aced0b641d17c11999b6b2ad2eb3e2fd50679e203cf4c",
          "executable": false
        },
        {
          "path": "package/cline-hub/webview/assets/architectureDiagram-T3A2C74G-BGNrlwUL.js",
          "size": 26857,
          "sha256": "79a67942c723070d545cf7e30c626be9cb8e0689a4789472d77d8d6c2f15eff1",
          "executable": false
        },
        {
          "path": "package/cline-hub/webview/assets/array-BifhSqXX.js",
          "size": 107,
          "sha256": "63126646dbf611a0cf9e2293a9f636ac3c93c815a8f7d1e97d783151ab8529b9",
          "executable": false
        },
        {
          "path": "package/cline-hub/webview/assets/badge-X4W3Q0cc.js",
          "size": 1642,
          "sha256": "998a369abbdfb3d8bdd9261980324e413d55e7ef26d47c8cb9ef74e80ef26929",
          "executable": false
        },
        {
          "path": "package/cline-hub/webview/assets/bash-B7CDPTg5.js",
          "size": 62,
          "sha256": "d4efcb4b33d3ec1114bee9eec491718886de8f07f63e6c29dbda74c404ee2738",
          "executable": false
        },
        {
          "path": "package/cline-hub/webview/assets/blockDiagram-VBNYF7ZC-CvIo5nET.js",
          "size": 72721,
          "sha256": "a8c5f6ec47b94e8385402882fbc6ed6b7bee0bec576e2b970241a059c7a58659",
          "executable": false
        },
        {
          "path": "package/cline-hub/webview/assets/bundle-mjs-CyB9GzWm.js",
          "size": 38634,
          "sha256": "7224b91e659cc2680a5fd11d2eff3451cc0baec9d830134b3c10a61d6144fed8",
          "executable": false
        },
        {
          "path": "package/cline-hub/webview/assets/c4Diagram-5PPSVZJV-B91Sv2Na.js",
          "size": 69161,
          "sha256": "f825d4808d121229fb361ce4d0e82d498ef6315f200ccfbc1ff0aa5e8179ddb8",
          "executable": false
        },
        {
          "path": "package/cline-hub/webview/assets/channel-Cn9dB4WD.js",
          "size": 114,
          "sha256": "1684f70d3c812dce143476cf085890b01e33f8afe1d69e32bfc13bb355cfa0d9",
          "executable": false
        },
        {
          "path": "package/cline-hub/webview/assets/chunk-2GRJ4B5K-u4MGLwtv.js",
          "size": 1972,
          "sha256": "c2af4a358dc833e721ac4619a0dcb54815b8d3c5864692cbd52396dba2c5eda0",
          "executable": false
        },
        {
          "path": "package/cline-hub/webview/assets/chunk-2Q5K7J3B-C1jixKkw.js",
          "size": 191,
          "sha256": "675dd6cbaeea3bf091ba6afb397cf4c3debf6b66cc7bee6d115d87fa831e05fc",
          "executable": false
        },
        {
          "path": "package/cline-hub/webview/assets/chunk-4I5QYGJK-0RNwvBrV.js",
          "size": 5833,
          "sha256": "8308b3bc4d8bc1622c5e2542cfbe5fac98b34575e18f6f0d2bb52abcd94c75b8",
          "executable": false
        },
        {
          "path": "package/cline-hub/webview/assets/chunk-5RXB4S5H-BHjkdRhh.js",
          "size": 37726,
          "sha256": "2b99f08bf58820c95413ac1be8feb6351ac5ae1a569e881a7c3f61d4c13fc1f2",
          "executable": false
        },
        {
          "path": "package/cline-hub/webview/assets/chunk-5VM5RSS4-ZNzvKenW.js",
          "size": 362,
          "sha256": "cee7c98f98440b1fbf0548b756d421097642c784547b835515f1124b9cdd4351",
          "executable": false
        },
        {
          "path": "package/cline-hub/webview/assets/chunk-6Q2QTUOP-CLgL8rxg.js",
          "size": 15644,
          "sha256": "f26bc5595f9daef7b29ad97df36ecd29e32501371def26214eacbabf791d4ce6",
          "executable": false
        },
        {
          "path": "package/cline-hub/webview/assets/chunk-7BUUIJ7U-Bb538aSH.js",
          "size": 2105,
          "sha256": "713d44d47668389e28fd9aecb4c6a5938a9d7ee7eceae04ec3857a98f58b87f3",
          "executable": false
        },
        {
          "path": "package/cline-hub/webview/assets/chunk-7Z6QIM7H-C6_Ywz3w.js",
          "size": 33956,
          "sha256": "bfd22ec803770be6773374ff08caa4a6bcbaecc90777d3487064c22fb0efab6a",
          "executable": false
        },
        {
          "path": "package/cline-hub/webview/assets/chunk-GF5L2VYU-iIVxDVKm.js",
          "size": 48829,
          "sha256": "ae646755a4900925237a437dbbd38bfee8df2a945e23aa01716a8012c2209cdf",
          "executable": false
        },
        {
          "path": "package/cline-hub/webview/assets/chunk-I66GZJ75-DXqP3B91.js",
          "size": 207909,
          "sha256": "6134124a06f2a2d68abe56d23957973f347cbcf57228eff5bd9dc03daa1f6bf0",
          "executable": false
        },
        {
          "path": "package/cline-hub/webview/assets/chunk-JQJVKLGR-CmK9TOTe.js",
          "size": 60157,
          "sha256": "2f67aac7f930247ac0aa85f155ef482e51c5048c9d738809cf5764044cbb20b2",
          "executable": false
        },
        {
          "path": "package/cline-hub/webview/assets/chunk-JWPE2WC7-DVXcaiue.js",
          "size": 223,
          "sha256": "11e56beaf2526e7304036d27b4e083ed68ced60066faded0e683115da3dfa099",
          "executable": false
        },
        {
          "path": "package/cline-hub/webview/assets/chunk-KBJHAD2P-L-89C026.js",
          "size": 574,
          "sha256": "4313a76f40c64d34456d4a780468ad27116f0305d39e8f65aee4b38f6ab05a66",
          "executable": false
        },
        {
          "path": "package/cline-hub/webview/assets/chunk-NSK5VX7P-D5026Kzu.js",
          "size": 30755,
          "sha256": "2ea34206073f6ca4ecb47044c4784fa6a87202a80eb27ed5592dbde5944bb60b",
          "executable": false
        },
        {
          "path": "package/cline-hub/webview/assets/chunk-QR6OTTB3-DgKOIk7B.js",
          "size": 101850,
          "sha256": "a812a00d5b07b67d55fd05d65214bf7b89467899bc32f6b7c341575054299e21",
          "executable": false
        },
        {
          "path": "package/cline-hub/webview/assets/chunk-RYQCIY6F-BUc8VYLJ.js",
          "size": 6498,
          "sha256": "c17446b165308a7971923318bb419edd1a6b3b9cc21b3d38530b1628d817c4ab",
          "executable": false
        },
        {
          "path": "package/cline-hub/webview/assets/chunk-UBXNYLIW-DzzRI8B_.js",
          "size": 968,
          "sha256": "063ef32411400574341ed4d3a359924ab4873d5975fe8b9bfd79c106029592e1",
          "executable": false
        },
        {
          "path": "package/cline-hub/webview/assets/chunk-W5SLKNZC-jIqX_Eb5.js",
          "size": 1849,
          "sha256": "2db334887247e7eab298f1fe9c58987557b703a58cd4282482ba7b7a2b7ea573",
          "executable": false
        },
        {
          "path": "package/cline-hub/webview/assets/chunk-WRU74C26-BSENSjFs.js",